{
  "schema_version": 1,
  "source_id": "github-1180386216",
  "head_sha": "5abdb3498716752a9a286505704513fe6b12bffb",
  "observed_at": "2026-08-18T17:17:07.406Z",
  "status": "verified",
  "manifest_path": "manifest.json",
  "folder_name": "SillyTavern-GiglioMachine",
  "manifest": {
    "display_name": "Giglio Machine",
    "key": null,
    "minimum_client_version": null
  }
}
