{
  "schema_version": 1,
  "source_id": "github-929287817",
  "head_sha": "d93c056ccdd7720253b167fe1a29ad0cbbe66f9d",
  "observed_at": "2026-08-18T17:17:07.406Z",
  "status": "verified",
  "manifest_path": "manifest.json",
  "folder_name": "Guinevere-UI-Extension",
  "manifest": {
    "display_name": "Guinevere UI Extension",
    "key": null,
    "minimum_client_version": null
  }
}
