{
  "schema_version": 1,
  "source_id": "github-1163573440",
  "head_sha": "142b1e4f20ffb5d609b55cf82bbc9dd76763e1a3",
  "observed_at": "2026-08-18T17:17:07.406Z",
  "status": "verified",
  "manifest_path": "manifest.json",
  "folder_name": "SillyTavern-Larson",
  "manifest": {
    "display_name": "Larson",
    "key": null,
    "minimum_client_version": "1.12.0"
  }
}
