{
  "schema_version": 1,
  "source_id": "github-861668394",
  "head_sha": "9ce8a5500a1159d145d2e9ee4c6707a304d1d883",
  "observed_at": "2026-08-18T17:17:07.406Z",
  "status": "verified",
  "manifest_path": "manifest.json",
  "folder_name": "st-group-utils",
  "manifest": {
    "display_name": "Group Utilities",
    "key": null,
    "minimum_client_version": null
  }
}
