{
  "schema_version": 1,
  "source_id": "github-1087049931",
  "head_sha": "314513bd0bdc4914e74735737a98b7d42e06baf4",
  "observed_at": "2026-08-18T17:17:07.406Z",
  "status": "verified",
  "manifest_path": "manifest.json",
  "folder_name": "SillyTavern-User-Persona-Extended",
  "manifest": {
    "display_name": "User Persona Extended",
    "key": null,
    "minimum_client_version": null
  }
}
