{
  "schema_version": 1,
  "source_id": "github-1135951236",
  "head_sha": "9ef9272d678f0d50a0f37c6548201cc60f42e365",
  "observed_at": "2026-09-30T13:54:14.207Z",
  "status": "verified",
  "manifest_path": "manifest.json",
  "folder_name": "danganronpa-sillytavern",
  "manifest": {
    "display_name": "Danganronpa Extension",
    "key": null,
    "minimum_client_version": null
  }
}
