{
  "schema_version": 1,
  "source_id": "github-1334521822",
  "head_sha": "1bceed6afb0c48c21d0311b86450ed8861314876",
  "observed_at": "2026-08-21T08:02:25.266Z",
  "status": "verified",
  "manifest_path": "manifest.json",
  "folder_name": "SillyTavern-SillyToast",
  "manifest": {
    "display_name": "SillyToast",
    "key": null,
    "minimum_client_version": null
  }
}
