{
  "schema_version": 1,
  "source_id": "github-1221995274",
  "head_sha": "b03de4b82c447ba76ee62cfc7032c5339223c1fc",
  "observed_at": "2026-08-18T17:17:07.406Z",
  "status": "verified",
  "manifest_path": "manifest.json",
  "folder_name": "charswitchpro",
  "manifest": {
    "display_name": "⊹ CHARSWITCH PRO ⊹",
    "key": null,
    "minimum_client_version": null
  }
}
