{
  "schema_version": 1,
  "source_id": "github-1126135302",
  "head_sha": "aa40c45d1c4cf45d17b13bede80253063a4be9fa",
  "observed_at": "2026-08-30T13:00:23.889Z",
  "status": "verified",
  "manifest_path": "manifest.json",
  "folder_name": "Extension-TokenUsage",
  "manifest": {
    "display_name": "Token Usage Tracker",
    "key": null,
    "minimum_client_version": null
  }
}
