{
  "schema_version": 1,
  "source_id": "github-1262742050",
  "head_sha": "7c6c7cdc659b1c45c61c663db80bbfc1e3ff2be5",
  "observed_at": "2026-10-27T13:26:18.056Z",
  "status": "verified",
  "manifest_path": "manifest.json",
  "folder_name": "SillyTavern-GroupWorld",
  "manifest": {
    "display_name": "Group World",
    "key": null,
    "minimum_client_version": null
  }
}
