{
  "schema_version": 1,
  "source_id": "github-1068235084",
  "head_sha": "f0ad9a5eeff25b83474f75741ff65f2ddf69f540",
  "observed_at": "2026-08-18T17:17:07.406Z",
  "status": "verified",
  "manifest_path": "manifest.json",
  "folder_name": "SillyTavern-GenerationLocks",
  "manifest": {
    "display_name": "Generation Locks",
    "key": null,
    "minimum_client_version": null
  }
}
