{
  "schema_version": 1,
  "source_id": "github-1138145456",
  "head_sha": "be02bb1027e3f9b55a5ebb9d22860fc93262d8d8",
  "observed_at": "2026-08-18T17:17:07.406Z",
  "status": "verified",
  "manifest_path": "manifest.json",
  "folder_name": "chara-color-filter",
  "manifest": {
    "display_name": "Chara Color Filter",
    "key": null,
    "minimum_client_version": null
  }
}
