{
  "schema_version": 1,
  "source_id": "github-1160848402",
  "head_sha": "5b818855c0f8a4f93a9633eaff4f1287ac26ab9c",
  "observed_at": "2026-09-29T14:10:00.149Z",
  "status": "verified",
  "manifest_path": "manifest.json",
  "folder_name": "BetterSimTracker",
  "manifest": {
    "display_name": "BetterSimTracker",
    "key": null,
    "minimum_client_version": null
  }
}
